{"artifacts":[{"record":{"imported_event_id":"00000000000000000000000014","kind":"character-card-v2","revision_hash":"sha256:0000000000000000000000000000000000000000000000000000000000000003","semantic_hash":"sha256:0000000000000000000000000000000000000000000000000000000000000005","source_blob_hash":"sha256:0000000000000000000000000000000000000000000000000000000000000006","source_format":"json"},"source":null}],"baseline":{"branch":{"branch_id":"00000000000000000000000002","created_event_id":"00000000000000000000000015","forked_from_turn_id":null,"greeting":"Welcome.","greeting_index":0,"greeting_revision_hash":"sha256:0000000000000000000000000000000000000000000000000000000000000003","parent_branch_id":null,"session_id":"00000000000000000000000005"},"session":{"archived":false,"created_event_id":"00000000000000000000000015","current_config_hash":"sha256:0000000000000000000000000000000000000000000000000000000000000001","root_branch_id":"00000000000000000000000002","session_id":"00000000000000000000000005"}},"capabilities":{"inspect":true,"replay":true,"rerun":true},"compatibility":{"feature_manifest_digest":"sha256:0000000000000000000000000000000000000000000000000000000000000007","profile":"sillytavern-1.18-core"},"configuration":{"configuration":{"character_revision":"sha256:0000000000000000000000000000000000000000000000000000000000000003","compatibility_profile":"sillytavern-1.18-core","generation_settings":{},"lorebook_revisions":[],"persona_name":"User","prompt_preset_revision":null,"provider":{"api_key_env":null,"base_url":"https://127.0.0.1:443","ca_certificate_pem":"CANONICAL TEST CERTIFICATE","chat_completions_path":"/v1/chat/completions","id":"provider-test-process","model":"fixture-model","static_headers":{},"stream":true,"timeout_seconds":2},"tokenizer":"tiktoken:o200k_base"},"created_event_id":"00000000000000000000000016","revision_hash":"sha256:0000000000000000000000000000000000000000000000000000000000000001"},"effects":{"clock_outcomes":[],"compatibility_warnings":[],"effective_generation_settings":{"provenance":{"continue_prefill":"profile","max_context":"profile","max_tokens":"profile","squash_system_messages":"profile","use_sysprompt":"profile"},"values":{"continue_prefill":false,"max_context":8192,"max_tokens":512,"squash_system_messages":false,"use_sysprompt":true}},"lore":{"activated":[],"budget_tokens":2048,"decisions":[],"overflowed":false,"used_tokens":0},"macro_evaluations":[],"macro_warnings":[],"plugins":[],"preset_transformations":[],"provider_request":{"max_tokens":512,"messages":[{"content":"Write Alice's next reply in a fictional chat between Alice and User.","role":"system"},{"content":"A librarian.\n\nCurious\n\nAn old library","role":"system"},{"content":"Welcome.","role":"assistant"},{"content":"Hello","role":"user"}],"model":"fixture-model","stream":true},"provider_request_hash":"sha256:0000000000000000000000000000000000000000000000000000000000000002","rng_seed":0,"state_mutations":[]},"engine":{"version":"0.1.0"},"format":"stcli_turn_capsule","identity":{"attempt_id":"00000000000000000000000001","branch_id":"00000000000000000000000002","session_id":"00000000000000000000000005","turn_id":"00000000000000000000000006"},"kind":"thin","prompt":{"continuation_prefix":null,"generation_type":"normal","lore":{"activated":[],"budget_tokens":2048,"decisions":[],"overflowed":false,"used_tokens":0},"macro_evaluations":[],"macro_warnings":[],"messages":[{"content":"Write Alice's next reply in a fictional chat between Alice and User.","role":"system"},{"content":"A librarian.\n\nCurious\n\nAn old library","role":"system"},{"content":"Welcome.","role":"assistant"},{"content":"Hello","role":"user"}],"parent_candidate_id":null,"plugin_receipts":[],"pruning":{"context_limit":8192,"kept_tokens":26,"prompt_limit":7680,"pruned_tokens":0,"response_reserve":512},"rng_seed":0,"segments":[{"content":"Write Alice's next reply in a fictional chat between Alice and User.","in_chat_depth":null,"in_chat_order":0,"pruned":false,"raw_content":"Write Alice's next reply in a fictional chat between Alice and User.","role":"system","slot":"main","source":"main-prompt","source_field":null,"source_revision":null,"token_count":14,"truncation_priority":4294967295},{"content":"A librarian.\n\nCurious\n\nAn old library","in_chat_depth":null,"in_chat_order":0,"pruned":false,"raw_content":"A librarian.\n\nCurious\n\nAn old library","role":"system","slot":"charDescription","source":"character-definitions","source_field":null,"source_revision":"sha256:0000000000000000000000000000000000000000000000000000000000000003","token_count":9,"truncation_priority":800},{"content":"Welcome.","in_chat_depth":null,"in_chat_order":0,"pruned":false,"raw_content":"Welcome.","role":"assistant","slot":"chatHistory","source":"greeting","source_field":null,"source_revision":"sha256:0000000000000000000000000000000000000000000000000000000000000003","token_count":2,"truncation_priority":75},{"content":"Hello","in_chat_depth":null,"in_chat_order":0,"pruned":false,"raw_content":"Hello","role":"user","slot":"userInput","source":"current-user-action","source_field":null,"source_revision":null,"token_count":1,"truncation_priority":4294967295}],"state_mutations":[],"tokenizer":"tiktoken:o200k_base","total_tokens":26},"provider":{"receipt":{"chunks":[{"choices":[{"delta":{"role":"assistant"},"finish_reason":null,"index":0}],"created":0,"id":"chatcmpl-stcli-fixture","model":"fixture-model","object":"chat.completion.chunk"},{"choices":[{"delta":{"content":"fixture-response:sha256:2c95a1b3f29beb8826fc"},"finish_reason":null,"index":0}],"created":0,"id":"chatcmpl-stcli-fixture","model":"fixture-model","object":"chat.completion.chunk"},{"choices":[{"delta":{"content":"2b1297ad6d634d2c505229010359caec02573c995d1f"},"finish_reason":null,"index":0}],"created":0,"id":"chatcmpl-stcli-fixture","model":"fixture-model","object":"chat.completion.chunk"},{"choices":[{"delta":{},"finish_reason":"stop","index":0}],"created":0,"id":"chatcmpl-stcli-fixture","model":"fixture-model","object":"chat.completion.chunk","usage":{"completion_tokens":3,"prompt_tokens":7,"total_tokens":10}}],"status":200},"request_hash":"sha256:0000000000000000000000000000000000000000000000000000000000000002"},"redactions":[],"references":[{"blob_hash":"sha256:0000000000000000000000000000000000000000000000000000000000000006","embedded":false,"owner_id":"sha256:0000000000000000000000000000000000000000000000000000000000000003","owner_kind":"artifact-revision"}],"result":{"projection":{"attempt":{"attempt_id":"00000000000000000000000001","branch_id":"00000000000000000000000002","caller":null,"completed_event_id":"00000000000000000000000003","config_hash":"sha256:0000000000000000000000000000000000000000000000000000000000000001","created_event_id":"00000000000000000000000004","effect_receipt":{"clock_outcomes":[],"compatibility_warnings":[],"effective_generation_settings":{"provenance":{"continue_prefill":"profile","max_context":"profile","max_tokens":"profile","squash_system_messages":"profile","use_sysprompt":"profile"},"values":{"continue_prefill":false,"max_context":8192,"max_tokens":512,"squash_system_messages":false,"use_sysprompt":true}},"lore":{"activated":[],"budget_tokens":2048,"decisions":[],"overflowed":false,"used_tokens":0},"macro_evaluations":[],"macro_warnings":[],"plugins":[],"preset_transformations":[],"provider_request":{"max_tokens":512,"messages":[{"content":"Write Alice's next reply in a fictional chat between Alice and User.","role":"system"},{"content":"A librarian.\n\nCurious\n\nAn old library","role":"system"},{"content":"Welcome.","role":"assistant"},{"content":"Hello","role":"user"}],"model":"fixture-model","stream":true},"provider_request_hash":"sha256:0000000000000000000000000000000000000000000000000000000000000002","rng_seed":0,"state_mutations":[]},"effective_generation_settings":{"provenance":{"continue_prefill":"profile","max_context":"profile","max_tokens":"profile","squash_system_messages":"profile","use_sysprompt":"profile"},"values":{"continue_prefill":false,"max_context":8192,"max_tokens":512,"squash_system_messages":false,"use_sysprompt":true}},"error_message":null,"kind":"primary","parent_attempt_id":null,"prompt_plan":{"continuation_prefix":null,"generation_type":"normal","lore":{"activated":[],"budget_tokens":2048,"decisions":[],"overflowed":false,"used_tokens":0},"macro_evaluations":[],"macro_warnings":[],"messages":[{"content":"Write Alice's next reply in a fictional chat between Alice and User.","role":"system"},{"content":"A librarian.\n\nCurious\n\nAn old library","role":"system"},{"content":"Welcome.","role":"assistant"},{"content":"Hello","role":"user"}],"parent_candidate_id":null,"plugin_receipts":[],"pruning":{"context_limit":8192,"kept_tokens":26,"prompt_limit":7680,"pruned_tokens":0,"response_reserve":512},"rng_seed":0,"segments":[{"content":"Write Alice's next reply in a fictional chat between Alice and User.","in_chat_depth":null,"in_chat_order":0,"pruned":false,"raw_content":"Write Alice's next reply in a fictional chat between Alice and User.","role":"system","slot":"main","source":"main-prompt","source_field":null,"source_revision":null,"token_count":14,"truncation_priority":4294967295},{"content":"A librarian.\n\nCurious\n\nAn old library","in_chat_depth":null,"in_chat_order":0,"pruned":false,"raw_content":"A librarian.\n\nCurious\n\nAn old library","role":"system","slot":"charDescription","source":"character-definitions","source_field":null,"source_revision":"sha256:0000000000000000000000000000000000000000000000000000000000000003","token_count":9,"truncation_priority":800},{"content":"Welcome.","in_chat_depth":null,"in_chat_order":0,"pruned":false,"raw_content":"Welcome.","role":"assistant","slot":"chatHistory","source":"greeting","source_field":null,"source_revision":"sha256:0000000000000000000000000000000000000000000000000000000000000003","token_count":2,"truncation_priority":75},{"content":"Hello","in_chat_depth":null,"in_chat_order":0,"pr